id,session_number,session_id,session_name,room,day,day_part,time,submission_id,presenter_name,title,deltager_id,email,weighted_average_rating,authors,keywords,pdf,early_career_scholar,presenter_citations,last_authors_citations,upload_link,session_id
62,11,2C,Polarization II,C,1,1,14.45,791,Ali Faqeeh,Political polarization: Persistent hatred or issue-dependent sidings?,21171922,faqeeh.ali@gmail.com,1.375,Ali Faqeeh|Letizia Iannucci|Ted Hsuan Yun Chen|Mikko Kivelä,Large-scale social phenomena|Network analysis of social systems|computational methods|cultural patterns and dynamics|polarization and government,/pdf/f8a99a12a1d5894b7700fb19b4837866e3b690a9.pdf,,189,5062,https://www.dropbox.com/request/EX8LiVWPZlmXZjj7nMl3,2C
63,11,2C,Polarization II,C,1,1,15,560,Ali Salloum,Separating Polarization from Noise: Comparison and Normalization of Structural Polarization Measures,21171085,ali.salloum@aalto.fi,1,Ali Salloum|Ted Hsuan Yun Chen|Mikko Kivelä,network science|polarization|twitter|community detection|statistical significance,/pdf/138bfd6445a82fff7953419ef9446a14465be9b5.pdf,Yes,136,5062,https://www.dropbox.com/request/EX8LiVWPZlmXZjj7nMl4,2C
64,11,2C,Polarization II,C,1,1,15.15,29,Christian Staal Bruun Overgaard,The Manifestation of Affective Polarization on Social Media: A Cross-Platform Supervised Machine Learning Approach,21035480,cstaal88@gmail.com,1,Christian Staal Bruun Overgaard|Josephine Lukito|Kaiya Soorholtz,affective polarization|BERT|mass polarization|social media|supervised machine learning,/pdf/365f14778e3c309eccbdfcd0f1717a7887fb01f2.pdf,Yes,511,0,https://www.dropbox.com/request/EX8LiVWPZlmXZjj7nMl5,2C
65,11,2C,Polarization II,C,1,1,15.3,670,Fatima Alqabandi,Self-censorship and political identity on social media ,21162517,fatima.alqabandi@duke.edu,1.23076923,Fatima Alqabandi,Self-censorship|political polarization|social media|online messaging|communication,/pdf/13172e812763105d5cd63d74cfe39ec2074cf519.pdf,Yes,0,0,https://www.dropbox.com/request/EX8LiVWPZlmXZjj7nMl6,2C
66,11,2C,Polarization II,C,1,1,15.45,701,Eckehard Olbrich,Analysing the structure of high-dimensional opinion spaces - the example of Swiss popular votes,21079702,olbrich@mis.mpg.de,0.91666667,Eckehard Olbrich|Sven Banisch,issue bundles|correlated class analysis|belief networks|political polarization,/pdf/a9e63579820f2a6699d68ad10c673bf1ab8031a0.pdf,,1883,458,https://www.dropbox.com/request/EX8LiVWPZlmXZjj7nMl7,2C
67,12,2D,Social Media I,D,1,1,14.3,797,Armin Pournaki,Two years of Trending Topics: Measuring Issue Alignment in the German Twittersphere,21133648,felix.gaisbauer@weizenbaum-institut.de,2,Armin Pournaki|Felix Gaisbauer|Eckehard Olbrich,Twitter|large-scale social phenomena|issue alignment|network analysis|topic modeling,/pdf/b94507c30835790faf03276d5dfd99200d555c09.pdf,Yes,30,1883,https://www.dropbox.com/request/sxnv5hYr1U8etqAYmOat,2D
68,12,2D,Social Media I,D,1,1,14.45,881,Bradley Spahn,Measuring Conversational Contentiousness on Reddit with Sub-Graph Motifs,21175284,bradleyspahn@gmail.com,2,Bradley Spahn|Sahil Verma,Conversations|Discussion|Motifs|Conflict|Community,/pdf/b837424d10251f34bd159bbd7c1238c203acb534.pdf,Yes,68,530,https://www.dropbox.com/request/sxnv5hYr1U8etqAYmOat,2D
69,12,2D,Social Media I,D,1,1,15,783,Pedro Ramaciotti,Extreme swingers: explaining political preference change from far-left to far-right in Twitter users,21134037,pournaki@mis.mpg.de,2,Armin Pournaki|Pedro Ramaciotti Morales,ideal point estimation|polarization|dimensionality|proximity voting|Twitter,/pdf/92eda54ad1895e528cd818bd4b296762d92ba2f3.pdf,Yes,121,121,https://www.dropbox.com/request/sxnv5hYr1U8etqAYmOat,2D
70,12,2D,Social Media I,D,1,1,15.15,818,Yuta Tomokiyo,Characteristics and Interest Topic Extraction of Non-Partisan Clusters in Social Media: Case Study of the National Funeral for Former PM Shinzo Abe,21161670,y.tomo1125@gmail.com,1.5,Yuta Tomokiyo|Kimitaka Asatani|Kunihiro Miyazaki|Fujio Toriumi|Ichiro Sakata,non-partisan|social media|political discussion|Top2Vec|opinion mining,/pdf/5479498bdec255e116d2722fc194a46df5223e5a.pdf,,68,1435,https://www.dropbox.com/request/sxnv5hYr1U8etqAYmOat,2D
71,12,2D,Social Media I,D,1,1,15.3,656,Matija Franklin,Blame attribution in human-AI and human-only systems: Crowdsourcing judgments from Twitter,21175320,matija.franklin@ucl.ac.uk,2,Matija Franklin|Trisevgeni Papakonstantinou|Tianshu Chen|Carlos Fernandez-Basso|David Lagnado,Blame|Attribution|Artificial Intelligence|Twitter,/pdf/d5734a358fb7d3dffbb72b928487c4d82a945385.pdf,Yes,43,4934,https://www.dropbox.com/request/sxnv5hYr1U8etqAYmOat,2D
72,12,2D,Social Media I,D,1,1,15.45,192,Nir Grinberg,Supersharers of Fake News on Twitter,21079858,nirgrn@bgu.ac.il,2,Sahar Baribi-Bartov|Briony Swire-Thompson|Nir Grinberg,Fake news|social media|twitter|misinformation|supersharers,/pdf/840ab548516468681d70f768664b60c5324eaf32.pdf,Yes,1177,1177,https://www.dropbox.com/request/sxnv5hYr1U8etqAYmOat,2D
73,13,2E,Mobility and Urban Data Science II,E,1,1,14.3,738,Ohhyun Kwon,Mobility potential as a window to explore social capital in urban systems,21163967,ohhyun@postech.ac.kr,1.64285714,Ohhyun Kwon|Damin Lee|Inho Hong|Jaehyuk Park|Hyejin Youn|Woo-Sung Jung,Human mobility|Potential field|Social capital|Economic connectivity|Urban structure,/pdf/c310f862f56063480421527a7f0e399c5c270962.pdf,Yes,9,15,https://www.dropbox.com/request/xDC4RIkmmLa5wNaiz0C3,2E
74,13,2E,Mobility and Urban Data Science II,E,1,1,14.45,422,Federico Delussu,Evidence of pandemic fatigue associated with stricter tiered COVID-19 restrictions,21192739,fedde@dtu.dk,1.69230769,Federico Delussu|Michele Tizzoni|Laetitia Gauvin,mobility|NPI|pandemic fatigue|human behaviour|mixed-effect regression models,/pdf/79f5ead5ed93666eeffc33388d2d1c8a87db6b8a.pdf,Yes,18,1147,https://www.dropbox.com/request/xDC4RIkmmLa5wNaiz0C4,2E
75,13,2E,Mobility and Urban Data Science II,E,1,1,15,335,Simone Centellegher,Long-term impact of job loss on individual mobility behaviour,21155800,centellegher@fbk.eu,1.5,Simone Centellegher|Lorenzo Lucchini|Marco Tonin|Bruno Lepri|Marco De Nadai,job loss detection|unemployment|human mobility|GPS mobility traces|behaviour change,/pdf/e778fbd964a90ab27735e1b16649c096506e70c0.pdf,Yes,235,1365,https://www.dropbox.com/request/xDC4RIkmmLa5wNaiz0C5,2E
76,13,2E,Mobility and Urban Data Science II,E,1,1,15.15,877,David Mingfei Liu,Disaggregating bike-share mobility data to measure urban segregation over time,21227438,liu.davi@northeastern.edu,1.25,David Mingfei Liu,urban segregation|mobility|transportation networks|network dynamics|bike share,/pdf/51010ded1f98e44aca2427aa128d67004dd9e4c1.pdf,Yes,318,0,https://www.dropbox.com/request/xDC4RIkmmLa5wNaiz0C6,2E
77,13,2E,Mobility and Urban Data Science II,E,1,1,15.3,700,Damin Lee,Mobility Connectedness: Uncovering socioeconomic bias and connectivity in urban mobility,21163887,damini@postech.ac.kr,1.61538462,Damin Lee|Ohhyun Kwon|Inho Hong|Jaehyuk Park|Woo-Sung Jung|Hyejin Youn,human mobility|income segregation|socioeconomic mixing|urban mobility,/pdf/9935b5af2ae8cd9a2d4c0ccc507e54b86890d2b0.pdf,Yes,504,1876,https://www.dropbox.com/request/xDC4RIkmmLa5wNaiz0C7,2E
78,13,2E,Mobility and Urban Data Science II,E,1,1,15.45,361,Nandini Iyer,How Can Transport Inequality Contribute to Housing Insecurity?,21171371,ni244@exeter.ac.uk,1.28571429,Nandini Iyer|Ronaldo Menezes|Hugo Barbosa,Human Mobility|Transit Networks|Commuting|Human Mobility|Social Mobility,/pdf/c41c0f242cd8471c7093d525c18a8efa83c87462.pdf,Yes,746,256,https://www.dropbox.com/request/xDC4RIkmmLa5wNaiz0C8,2E
79,14,2F,Digital behavior,F,1,1,14.3,334,Lorenzo Dall'Amico,Modeling participants compliance in a large-scale sociometric study in low- and middle-income environments,21039255,segreteria1@isi.it,1.36363636,Lorenzo Dall'Amico|Onicio Leal|Lonjezo Dzekedzeke|Beverly Laher|Guilherme Lichand|Ciro Cattuto,participant compliance|proximity networks|wearable sensors|human behavior|field studies,/pdf/e51b13ff72f4b341a80d57d856ba777eaac6594b.pdf,,72,11993,https://www.dropbox.com/request/14mDWeGzqRa9gVDMcsjv,2F
80,14,2F,Digital behavior,F,1,1,14.45,386,Alessandra Urbinati,Mapping users' checking habits in mobile app usage,21175172,anna.sapienza@isi.it,1.41666667,Anna Sapienza|Alessandra Urbinati|Salvatore Vilella,smartphones|mobile apps|digital behaviors|checking habits|complex networks,/pdf/4e4b6402946e145efa884a25bc8c63c88dfdd5db.pdf,,51,46,https://www.dropbox.com/request/14mDWeGzqRa9gVDMcsjv,2F
81,14,2F,Digital behavior,F,1,1,15,119,Roland Toth,"One App to Assess Them All ‚Äì Combining Logging, Experience Sampling, and Survey in an Android and iOS App",21162087,roland.toth@weizenbaum-institut.de,1.71428571,Roland Toth|Christian Strippel,smartphone|research app|survey|ESM|logging,/pdf/6a6383cf5e56b9ebf692541c0d9e3bf5890ebb39.pdf,Yes,305,129,https://www.dropbox.com/request/14mDWeGzqRa9gVDMcsjv,2F
82,14,2F,Digital behavior,F,1,1,15.15,426,Anna Sapienza,Exposure to urban and rural contexts shapes smartphone usage behavior,21157943,anna.sapienza@isi.it,1.23076923,Anna Sapienza|Marita Lítlá|Sune Lehmann|Laura Maria Alessandretti,Urban/rural divide|digital behaviour|smartphones|quasi-experimental design|matching,/pdf/b4b5dd7af532cade2a2a948414062e8a34894111.pdf,,390,0,https://www.dropbox.com/request/14mDWeGzqRa9gVDMcsjv,2F
83,14,2F,Digital behavior,F,1,1,15.3,389,Kristina Gligoric,Biased Bytes: On the Validity of Estimating Food Consumption from Digital Traces,20986319,kristinagligoric.ns@gmail.com,0.875,Kristina Gligoric|Irena Đorđević|Robert West,biases|validity|social media|food|images,/pdf/7fa548c923873ec8838141f24f89d6b65c9d1055.pdf,Yes,268,478,https://www.dropbox.com/request/14mDWeGzqRa9gVDMcsjv,2F
84,14,2F,Digital behavior,F,1,1,15.45,88,David Joachim Grüning,Directing Smartphone Use Through the Self-Nudge App one sec,21176355,david.gruening@psychologie.uni-heidelberg.de,1.33333333,David Joachim Grüning|Frederik Riedel|Philipp Lorenz-Spreen,app use|self-nudging|online behavior|field experiment|one sec,/pdf/b814e1db709d15ac3f1779e2706fa93c7a04fc89.pdf,Yes,0,0,https://www.dropbox.com/request/14mDWeGzqRa9gVDMcsjv,2F
85,15,2G,Online Discourse II,G,1,1,14.3,51,Chia-Jung Tsai,The interplay between refugee inflows and media coverage in determining attitudes towards immigrants in Germany,21120874,tsai@demogr.mpg.de,1.3,Chia-Jung Tsai|Robert Gordon Rinderknecht|Emilio Zagheni,anti-immigrant|refugee influx|media salience,/pdf/dca5d7cba488ea3b7c4b3daa6402fd4ccb11622e.pdf,Yes,0,2458,https://www.dropbox.com/request/9R9a3nBzAGtluSpQewEP,2G
86,15,2G,Online Discourse II,G,1,1,14.45,147,Ana Macanovic,Governing through Gossip: The Role of Informal Communication in the Presence of Reputation Systems in Online Markets,21161816,a.macanovic@uu.nl,1.64285714,Ana Macanovic|Wojtek Przepiorka|Vincent Buskens,trust|cooperation|gossip|text mining|big data,/pdf/ebd0aeaa0dd3dcb46179ec739eab6a8cd29634b3.pdf,Yes,5,3040,https://www.dropbox.com/request/9R9a3nBzAGtluSpQewEP,2G
87,15,2G,Online Discourse II,G,1,1,15,430,Felix Victor Münch,"""I Really Thought I Would Use More Than Just Google"" Developing and Testing a Browsing History Donation Approach With Journalists",21161896,f.muench@leibniz-hbi.de,1.69230769,Lisa Merten|Maren Schuster|Felix Victor Münch,data donations|journalism research|platform centralization|information systems|mixed methods,/pdf/f0f60d7236803ae911f211aef658afdd06e408ee.pdf,Yes,0,146,https://www.dropbox.com/request/9R9a3nBzAGtluSpQewEP,2G
88,15,2G,Online Discourse II,G,1,1,15.15,914,Aymeric Luneau,Modeling the cycles of attention of a social problem - the case of pesticide use in France,"21137574, 21137608",jeanphilippe.cointet@sciencespo.fr,1.30769231,Aymeric Luneau|Jean-Philippe Cointet,Controversy mapping|Text Analysis|Network Analysis|Frame Analysis,/pdf/3b2310178387e67dcc016caf32233bcf93af64f1.pdf,,0,0,https://www.dropbox.com/request/9R9a3nBzAGtluSpQewEP,2G
89,15,2G,Online Discourse II,G,1,1,15.3,157,Ralph Schroeder,"One Image, Two Mirrors: Mapping Chinese Populist Ultranationalism on Weibo and Twitter",21167595,ralph.schroeder@oii.ox.ac.uk,1.25,Yuan Zhang|Pu Yan|Ralph Schroeder,Populism|Ultra-nationalism|Natural Language Processing|Weibo|Twitter,/pdf/7400fcce41fb2b80f6bac852c30f6beb7fc9f877.pdf,Yes,5957,5957,https://www.dropbox.com/request/9R9a3nBzAGtluSpQewEP,2G
90,15,2G,Online Discourse II,G,1,1,15.45,310,Akira Matsui,Exploring Urban-Rural Disparities in the Production of Politicians' Information,21163151,matsui-akira-zr@ynu.ac.jp,1.55555556,Akira Matsui|Kunihiro Miyazaki|Taichi Murayama,,/pdf/4caf57a17e29d16ce19c3fd15b4cf5379ff8d1d6.pdf,Yes,116,293,https://www.dropbox.com/request/9R9a3nBzAGtluSpQewEP,2G
91,16,2H,Studies on Wikipedia,H,1,1,14.3,80,Tiziano Piccardi,Temporal Rhythms of Information Consumption on Wikipedia,21119061,piccardi@stanford.edu,2,Tiziano Piccardi|Martin Gerlach|Robert West,Wikipedia|Logs Analysis|Information seeking|Readers behavior|Daily Rhythms,/pdf/b4f01316a8f426f9a74f729d5ad47f3e419ba6c1.pdf,Yes,162,478,https://www.dropbox.com/request/AqhSzXwrkFblMj6Enf3e,2H
92,16,2H,Studies on Wikipedia,H,1,1,14.45,373,Akira Matsui,Computational Framework of AST Model Reveals Mechanism of Knowledge Accumulation,21163151,matsui-akira-zr@ynu.ac.jp,1.57142857,Akira Matsui|Emilio Ferrara,Knowledge production|AST model|coordination|empirical analysis|Wikipedia,/pdf/901beef15e4c97b5e8bd8454a70e01600f61d85b.pdf,Yes,1239,15501,https://www.dropbox.com/request/AqhSzXwrkFblMj6Enf3e,2H
93,16,2H,Studies on Wikipedia,H,1,1,15,908,Patrick Gildersleve,"depths of wikipedia: Understanding cross-platform online attention, content creation, and success",21158257,p.gildersleve@lse.ac.uk,1.69230769,Patrick Gildersleve,Collective attention|Wikipedia|Online navigation|Cross-platform|Novelty,/pdf/5d78f1da5d82d6b6edd8aafb8bfbae5daf0cb1ae.pdf,Yes,28,28,https://www.dropbox.com/request/AqhSzXwrkFblMj6Enf3e,2H
94,16,2H,Studies on Wikipedia,H,1,1,15.15,187,Akhil Arora,Orphan articles: The dark matter of Wikipedia,21180541,akhil.arora@epfl.ch,1.5,Akhil Arora|Martin Gerlach|Robert West,Wikipedia|knowledge gaps|multilinguality|visibility|quasi-experiment|network optimization|link recommendation,/pdf/b457fb8bf8bfec49b4caaf8e5408fb0b9f18def3.pdf,,444,478,https://www.dropbox.com/request/AqhSzXwrkFblMj6Enf3e,2H
95,16,2H,Studies on Wikipedia,H,1,1,15.3,173,Ivan Smirnov,Toxic comments reduce activity of volunteer editors on Wikipedia,21162881,smirnov@uni-mannheim.de,2,Ivan Smirnov|Camelia Oprea|Markus Strohmaier,Wikipedia|toxicity|harassment|Wikipedia editors|text analysis,/pdf/5f26641b5ced00cda7192c091f8563cd7ad7dbfd.pdf,,6802,5496,https://www.dropbox.com/request/AqhSzXwrkFblMj6Enf3e,2H
96,16,2H,Studies on Wikipedia,H,1,1,15.45,901,Veniamin Veselovsky,The Webonization of Wikipedia: Characterizing Wikipedia Linking Across the Web,21124577,veniamin.veselovsky@epfl.ch,1.25,Veniamin Veselovsky|Akhil Arora|Tiziano Piccardi|Ashton Anderson|Robert West,Wikipedia|World Wide Web|Wikipedia's Web presence|Linking patterns|Common Crawl,/pdf/45b634c756e3dde2d4feb6f8442d67a62000b638.pdf,Yes,17,478,https://www.dropbox.com/request/AqhSzXwrkFblMj6Enf3e,2H
97,17,3A,NLP and society I,A,2,0,11,138,Shreya Havaldar,Measuring Regional Variation in Culture Through Embedding-Based Lexica,21099437,shreyah@seas.upenn.edu,1,Shreya Havaldar|Salvatore Giorgi|Thomas Talhelm|Sharath Chandra Guntuku|Lyle Ungar,NLP|Culture|Word Embeddings|Regional Variance|Twitter,/pdf/5c8b1bd4068578fdaa7f2a79f038b4e295deeeb1.pdf,Yes,185,24085,https://www.dropbox.com/request/K55XisfRRoot7dUYj8o3,3A
98,17,3A,NLP and society I,A,2,0,11.15,437,James Calum Young,Strong Winds and Active Volcanoes: Unsupervised Methods for Linguistic Analysis of the Weather,21162410,jcy204@exeter.ac.uk,1,James Calum Young|Hywel T.P. Williams|Rudy Arthur,Sentiment Analysis|NLP|Extreme Weather|Social Media|Social Sensing,/pdf/0682c6a66cb9ea36ce0943fe44abf68961fa4a20.pdf,Yes,947,593,https://www.dropbox.com/request/K55XisfRRoot7dUYj8o4,3A
99,17,3A,NLP and society I,A,2,0,11.3,214,Camille Landesvatter,Open-Ended Survey Questions: A comparison of information content in text and audio response formats,21090883,camille.landesvatter@uni-mannheim.de,1.57142857,Camille Landesvatter|Paul C. Bauer,open-ended survey questions|speech-to-text|topic models|word embeddings|response entropy,/pdf/7d290ece867015ffb1ec38aeaf1ef38ea35ffb26.pdf,Yes,6,803,https://www.dropbox.com/request/K55XisfRRoot7dUYj8o5,3A
100,17,3A,NLP and society I,A,2,0,11.45,478,Hang Jiang,PersonaLLM: Investigating the Ability of GPT-3 to Express Personality Traits and Gender Differences,21153543,hjian42@mit.edu,1.45454545,Hang Jiang|Xiajie Zhang|Xubo Cao|Jad Kabbara,Large Language Models|Chatbot|Personality|Psycholinguistics|Agent-based Model,/pdf/f786d1c4f8e5d5c6d5c60f651145d8bf5b32aa53.pdf,Yes,655,54,https://www.dropbox.com/request/K55XisfRRoot7dUYj8o6,3A
101,17,3A,NLP and society I,A,2,0,12,584,Lucio La Cava,Get Out of the Nest! The Infodemic of the #TwitterMigration,21163518,lucio.lacava@dimes.unical.it,1.36363636,Lucio La Cava|Andrea Tagarelli|Luca Maria Aiello,Mastodon|Twitter|migration|social influence|DOSNs,/pdf/72a751e40d276b928bd16dcf47ba59d0110342a3.pdf,Yes,22,3619,https://www.dropbox.com/request/K55XisfRRoot7dUYj8o7,3A
102,17,3A,NLP and society I,A,2,0,12.15,780,Sanja Scepanovic,Topics of Our Dreams,21209063,sanja.scepanovic@nokia-bell-labs.com,2,Anubhab Das|Sanja Scepanovic|Luca Maria Aiello,dream analysis|NLP|content analysis|social media analysis|COVID-19,/pdf/96a07d0c2b047763d63a9f3243ac923a78b47c8a.pdf,Yes,309,3619,https://www.dropbox.com/request/K55XisfRRoot7dUYj8o8,3A
103,18,3B,Science of Science I,B,2,0,11,134,Onur Varol,Academic Support Network Reflects Doctoral Experience and Productivity,21163093,onur.varol@sabanciuniv.edu,1.38461538,Ozgur Can Seckin|Onur Varol,science of science|network science|text mining|scientific careers,/pdf/5e2d7f8b773d3ceec0e33936101d53b646936f88.pdf,,6542,6542,https://www.dropbox.com/request/oSwaoGoBpLJvc9CEuzRg,3B
104,18,3B,Science of Science I,B,2,0,11.15,821,Satyaki Sikdar,The COVID-19 research outbreak: how the pandemic culminated in a surge of new researchers,21070331,ssikdar@iu.edu,1.42857143,Sara Venturini|Satyaki Sikdar|Marie-Laure Charpignon|Sagar Kumar|Francesco Rinaldi|Francesco Tudisco|Santo Fortunato|Maimuna S Majumder,COVID-19|pandemic|science of science|newcomers|team dynamics,/pdf/68f5d6c632685ef115437d6ce5c8db4a6cb135e7.pdf,Yes,48,1889,https://www.dropbox.com/request/oSwaoGoBpLJvc9CEuzRg,3B
105,18,3B,Science of Science I,B,2,0,11.3,517,Sandro Ferreira Sousa,The impact of COVID-19 on scientific productivity and collaboration,21122955,ssou@itu.dk,1.27272727,Sandro Ferreira Sousa|Roberta Sinatra|Michael Szell|Yanmeng Xing,Scientific productivity|scientific collaboration|gender inequality|COVID-19|science of science,/pdf/43b7725a4bd18bbc33997ebc1faf002997434b28.pdf,Yes,30,781,https://www.dropbox.com/request/oSwaoGoBpLJvc9CEuzRg,3B
106,18,3B,Science of Science I,B,2,0,11.45,840,Minsu Park,Interdisciplinary Papers Supported by Disciplinary Grants Garner Deep and Broad Scientific Impact,21070783,mp5500@nyu.edu,1.63636364,Minsu Park|Suman Maity|Stefan Wuchty|Dashun Wang,Science of Science|Interdisciplinary Research|Grant-Paper Linkage|Research Impact|Measurement Framework,/pdf/db41fdce6b7a1a434292dc5335a6cef2a53080d9.pdf,,373,5914,https://www.dropbox.com/request/oSwaoGoBpLJvc9CEuzRg,3B
107,18,3B,Science of Science I,B,2,0,12,708,Jan Bachmann,Gender Disparities in Brokerage of Scientific Collaboration,21155343,bachmann@csh.ac.at,1.35714286,Jan Bachmann|Lisette Espin-Noboa|Gerardo Iñiguez|Fariba Karimi,gender inequalities|brokerage|triadic closure|temporal motifs|scientific collaboration,/pdf/d1ead172e63ec5531ecc368fd3fa4801fda0b31d.pdf,Yes,315,1217,https://www.dropbox.com/request/oSwaoGoBpLJvc9CEuzRg,3B
108,18,3B,Science of Science I,B,2,0,12.15,696,Claudia Acciai,Gendered trajectories in (early-career) international research mobility: mobility prospects and career impact,21158348,cla@soc.ku.dk,1.5,Claudia Acciai|Benjamin C Holding|Mathias Wullum Nielsen|Jesper Wiborg Schneider,Research Mobility|Gender Gap|Bibliometric Data|Research Careers|Stratification in Science,/pdf/2cdad3e3d20111c889f14df2860cfd4d996c4d50.pdf,Yes,46,2539,https://www.dropbox.com/request/oSwaoGoBpLJvc9CEuzRg,3B
109,19,3C,Social media II,C,2,0,11,41,Gianmarco De Francisci Morales,The Language of Opinion Change on Social Media under the Lens of Communicative Action,20992000,gdfm@acm.org,2,Corrado Monti|Luca Maria Aiello|Gianmarco De Francisci Morales|Francesco Bonchi,Opinion Change|Habermas|Reddit|Communicative Action|NLP,/pdf/cf2252301c723312d726c70fedc32e188412eb0a.pdf,,2786,12202,https://www.dropbox.com/request/uLqVtZAL9qFyxfZoq3xw,3C
110,19,3C,Social media II,C,2,0,11.15,268,Subhayan Mukerjee,Metrics at Work: How Social Media Metrics Shape News Production on Facebook,20987694,mail@subhayan.com,1,Subhayan Mukerjee|Tian Yang|Yilang Peng,social media|time series|panel data analysis|topic modeling|Facebook,/pdf/7fb871c9c7be20ac159abb34fda5c5e487fda9ae.pdf,Yes,107,215,https://www.dropbox.com/request/uLqVtZAL9qFyxfZoq3xw,3C
111,19,3C,Social media II,C,2,0,11.3,336,Mengjie Cheng,Managing Influencer-Brand Collaboration: Empirical Analysis of Social Media Influencers,21118022,macheng@hbs.edu,2,Mengjie Cheng|Shunyuan Zhang,video analytics|computational social science|influencer marketing|reputation|user generated content,/pdf/a49fc9801d65c28849f7738e57447e755e4a95ab.pdf,Yes,48,25,https://www.dropbox.com/request/uLqVtZAL9qFyxfZoq3xw,3C
112,19,3C,Social media II,C,2,0,11.45,342,Makoto Mizuno,Do People Signal Their Socioeconomic Status on Social Media? An Analysis of Conspicuous Tweeting by Machine Learning,21074203,makmizuno@gmail.com,1.33333333,Makoto Mizuno|Hiroki Takikawa,Socioeconomic Status|Cultural Capital|Tweets|Social Media|Signaling,/pdf/d9213d9ab9c0f26aaa278832e163b57d4d01577d.pdf,,370,188,https://www.dropbox.com/request/uLqVtZAL9qFyxfZoq3xw,3C
113,19,3C,Social media II,C,2,0,12,462,Tina Law,Controversial Events and Legislator (Non)responsiveness in the Age of Multimedia Online Platforms,21174434,tlaw@gc.cuny.edu,2,Tina Law|Em Bello-Pardo|Natalie McDaniel Gallagher,political communication|social media|text analysis|sentiment analysis|causal inference,/pdf/98440d9550037aaa3ccd4dca8c9ab5eeb4d83a4b.pdf,Yes,34,199,https://www.dropbox.com/request/uLqVtZAL9qFyxfZoq3xw,3C
114,19,3C,Social media II,C,2,0,12.15,279,Julia Szamely,Determinants of Willingness to Donate Data from Social Media Platforms,21167592,szamely_julia@phd.ceu.edu,1.64285714,Zoltan Kmetty|Adam Stefkovics|Julia Szamely|Dongning Deng|Kellner Aniko|Edit Paulo|Elisa Omodei|Julia Koltai,data donation|DDP|vignette experiments|digital trace data|linking survey data,/pdf/5c8bbbab0580921d3f4061ce8f5b166a19140488.pdf,Yes,0,179,https://www.dropbox.com/request/uLqVtZAL9qFyxfZoq3xw,3C
115,20,3D,Economic Complexity I,D,2,0,11,290,James Michelson,Incentive-Compatible Sampling Estimators,21163060,jamesmic@andrew.cmu.edu,1.57142857,James Michelson,surveys|sampling|game theory|mechanism design|Horvitz–Thompson estimator,/pdf/e1aeba76d5ef9baf64e0f5cb49d4b6affb520dac.pdf,Yes,4865,4865,https://www.dropbox.com/request/j65XHcMubM3epnf6gsfz,3D
116,20,3D,Economic Complexity I,D,2,0,11.15,622,Miruna Cotet,Dynamics of Bargaining,21097660,cotet.1@osu.edu,1.5,Miruna Cotet|Wenjia Zhao|Ian Krajbich,bargaining|response times|sequential sampling models|game theory|drift diffusion model,/pdf/477eef81a37708c1bed2bde039b39c4128acfff6.pdf,Yes,0,5081,https://www.dropbox.com/request/j65XHcMubM3epnf6gsfz,3D
117,20,3D,Economic Complexity I,D,2,0,11.3,514,Seongwoon Kim,Labor Space : A spatial representation of the labor market.,21163358,tjddns0032@gmail.com,2,Seongwoon Kim|Jaehyuk Park|Sonja Walter,Labor Space|Labor Market|Word Embedding|Computational Economics,/pdf/a566e69b5f9c8056ac871dc0624d15b9a29f4535.pdf,,338,65,https://www.dropbox.com/request/j65XHcMubM3epnf6gsfz,3D
118,20,3D,Economic Complexity I,D,2,0,11.45,472,Edward Lee,Costs of information for firms,20991869,edlee@csh.ac.at,1.09090909,Edward Lee|Alan Paul Kwan|Anjali Bhatt|Rudolf Hanel|Frank Neffke,information|costs|scaling|reading|firms,/pdf/c3a210555798d5d6adec6e86bc890b96017f044c.pdf,Yes,372,2854,https://www.dropbox.com/request/j65XHcMubM3epnf6gsfz,3D
119,20,3D,Economic Complexity I,D,2,0,12,125,Hirokazu Shirado,Extinction of reciprocity in a semi-automated driving coordination experiment,20986707,shirado@cmu.edu,2,Hirokazu Shirado|Shunichi Kasahara|Nicholas A Christakis,experiments|social coordination|reciprocity|semi-automation|human agency,/pdf/515aa45cd95a1d7675087b0d4c54d4809fbb3484.pdf,Yes,816,49869,https://www.dropbox.com/request/j65XHcMubM3epnf6gsfz,3D
120,20,3D,Economic Complexity I,D,2,0,12.15,844,Luis M Rocha,Social contact networks have small metric backbones that maintain community structure and are primary transmission subgraphs,0,rocha@binghamton.edu,1,Luis M Rocha|Rion Brattig Correia|Alain Barrat,,/pdf/,,0,0,https://www.dropbox.com/request/j65XHcMubM3epnf6gsfz,3D
121,21,3E,Mobility and Urban Data Science III,E,2,0,11,770,Sebastiano Bontorin,Mixing Individual and Collective Behaviours in Mobility Models,21061982,sbontorin@fbk.eu,2,Sebastiano Bontorin|Bruno Lepri|Riccardo Gallotti|Luca Pappalardo|Manlio De Domenico|Massimiliano Luca,Human Mobility|Human Behavior|Urban Systems|Novel Location Prediction|Mobility Networks,/pdf/bd8cf7f6ec1d2ee9507e386b6b6d5cf0a0c8ffd1.pdf,Yes,14,20,https://www.dropbox.com/request/wdeCGaW7Sz69sosSyDRB,3E
