id,session_number,session_id,session_name,room,day,day_part,time,submission_id,presenter_name,title,deltager_id,email,weighted_average_rating,authors,keywords,pdf,early_career_scholar,presenter_citations,last_authors_citations,upload_link,session_id
1,1,1A,Polarization I,A,1,0,11,50,Marilena Hohmann,Estimating Affective Polarization on a Social Network,21034503,marilena.hohmann@sodas.ku.dk,0.92857143,Marilena Hohmann|Michele Coscia,affective polarization|partisan hostility|social networks|network analysis|Twitter,/pdf/2d2d2ba7a38e9430b67f83a1b260edfa8513ae73.pdf,Yes,2,1957,https://www.dropbox.com/request/4M0jztL35ob6FIK2xJup,1A
2,1,1A,Polarization I,A,1,0,11.15,619,Tiancheng Hu,Overcoming Affective Polarization in Generative Language Models,21156123,th656@cam.ac.uk,1,Tiancheng Hu|Yara Kyrychenko|Sander van der Linden|Jon Roozenbeek,large language models|affective polarization|ingroup favoritism|outgroup derogation|social bias,/pdf/03238a97edff1249e5bc0881c0f41dbf3c36b9f8.pdf,Yes,23,2208,https://www.dropbox.com/request/4M0jztL35ob6FIK2xJup,1A
3,1,1A,Polarization I,A,1,0,11.3,172,Nikolaos Nakis,Characterizing Polarization in Social Networks using Archetypal Analysis,20986049,nnak@dtu.dk,1.57142857,Nikolaos Nakis|Abdulkadir CELIKKANAT|Louis Boucherie|Morten Mørup,polarization|social networks|link prediction|latent space modeling|embeddings,/pdf/b718b9b33fc16234d9b1061d3fbd9c0ade4c5377.pdf,Yes,6,4418,https://www.dropbox.com/request/4M0jztL35ob6FIK2xJup,1A
4,1,1A,Polarization I,A,1,0,11.45,606,Gianmarco De Francisci Morales,Evidence of Demographic rather than Ideological Segregation in News Discussion on Reddit,20992000,gdfm@acm.org,1.66666667,Corrado Monti|Jacopo D'Ignazi|Michele Starnini|Gianmarco De Francisci Morales,Homophily|Socio-demographic factors|Polarization|Echo Chambers|News|Reddit,/pdf/8e51380faaddf4c1de4b154383127d27332b9227.pdf,,2786,2786,https://www.dropbox.com/request/4M0jztL35ob6FIK2xJup,1A
5,1,1A,Polarization I,A,1,0,12,785,Homa Hosseinmardi,From shared to separate: Tracking polarization in the production and consumption of American TV news,21176365,homahm@seas.upenn.edu,2,Homa Hosseinmardi|Sam Wolken|David Rothschild|Duncan Watts,agenda setting|television news|media bias|selection|framing,/pdf/f32b8c39d6220e25952a2c8a374766d35473bfca.pdf,,1038,80721,https://www.dropbox.com/request/4M0jztL35ob6FIK2xJup,1A
6,1,1A,Polarization I,A,1,0,12.15,196,Li Zhang,Predicting polarisation of dynamic social networks via graph auto-encoders,21163302,ziyangli10372@gmail.com,1.09090909,Li Zhang|Isabelle Lorge|Janet B. Pierrehumbert|Xiaowen Dong,Dynamic social networks|Network heterogeneity|Polarisation prediction|Signed graph clustering|Graph auto-encoders,/pdf/e8a1168b0466b17805056175192628c86d3a9dff.pdf,,927,752,https://www.dropbox.com/request/4M0jztL35ob6FIK2xJup,1A
7,2,1B,Social networks I,B,1,0,11,657,Melanie Oyarzun,Friendship Modulates Hierarchical Relations in Public Elementary Schools,21158465,moyarzunw@udd.cl,1.61538462,Melanie Oyarzun|Carlos Rodriguez-Sickert|Cristian E Candia,Cooperation|Friendship|Social Hierarchy|Network Science and Complex Systems,/pdf/255e59e03c50a4071f3fb83714b8b2010dda2183.pdf,Yes,35,0,https://www.dropbox.com/request/jApceJj37Xqc1rQyaaVy,1B
8,2,1B,Social networks I,B,1,0,11.15,481,Takahiro Yabe,Behavior-based dependency networks improve predictability of economic resilience,21048797,tyabe@mit.edu,2,Takahiro Yabe|Bernardo Garcia Bulle Bueno|Morgan Ryan Frank|Alex Pentland|Esteban Moro,resilience|human mobility|economic networks|cities|network dependence,/pdf/f5b92c9ae822a9de2e936b17aecdde778a456897.pdf,Yes,729,2420,https://www.dropbox.com/request/jApceJj37Xqc1rQyaaVy,1B
9,2,1B,Social networks I,B,1,0,11.3,511,Edwin De Jonge,Development of Educational Segregation Measured using Longitudinal Population Scale Network Data,21163603,e.dejonge@cbs.nl,1.5,Dingeman Jan Van der Laan|Edwin De Jonge|Marjolijn Das,etwork analysis|segregation|complete population|longitudinal|education level,/pdf/9ae5856e0931392561c5f0182afdd059eb1a0ba9.pdf,,194,433,https://www.dropbox.com/request/jApceJj37Xqc1rQyaaVy,1B
10,2,1B,Social networks I,B,1,0,11.45,893,Veniamin Veselovsky,The Amplification Paradox in Recommender Systems,21124577,veniamin.veselovsky@epfl.ch,1.5,Manoel Horta Ribeiro|Veniamin Veselovsky|Robert West,recommender systems|radicalization|algorithmic auditing|YouTube,/pdf/eb5dd93157be412eb931d70931801684a91b6770.pdf,Yes,17,292,https://www.dropbox.com/request/jApceJj37Xqc1rQyaaVy,1B
11,2,1B,Social networks I,B,1,0,12,802,Mark E Whiting,Population-level common sense,21175466,markew@seas.upenn.edu,1.42857143,Mark E Whiting|Duncan J Watts,common sense|network analysis|belief network,/pdf/3aa421ced4021cf75ec78b12ed43bec93858814d.pdf,,3119,80721,https://www.dropbox.com/request/jApceJj37Xqc1rQyaaVy,1B
12,2,1B,Social networks I,B,1,0,12.15,634,Marc Sadurní Parera,Emergence of social hierarchies in a society of two competitive classes,21027871,marc.sadurni@ub.edu,1,Marc Sadurní Parera|Josep Perelló|Miquel Montero,Agent-based models|Social hierarchies|Inequalities|Stochastic processes|Complex Systems,/pdf/dc21e1c3401589d5cc7f6c671737bf86faf2835a.pdf,Yes,0,853,https://www.dropbox.com/request/jApceJj37Xqc1rQyaaVy,1B
13,3,1C,Inequalities and bias,C,1,0,11,489,Jamell Dacon,Beyond Race and Gender: A Look at Sociodemographic Biases Toward Persons with Disabilities,21176602,daconjam@msu.edu,1.33333333,Jamell Dacon|Jiliang Tang,Fairness|Inclusivity|Race|Gender|Disability,/pdf/f09e678396e2a3e179d60832122a67e8408cade3.pdf,Yes,123,21530,https://www.dropbox.com/request/Ve4t6kWms5C7oHJIiq4P,1C
14,3,1C,Inequalities and bias,C,1,0,11.15,855,Minsu Park,Fighting bias with bias: How same-race endorsements reduce racial discrimination on Airbnb,21070783,mp5500@nyu.edu,2,Minsu Park|Chao Yu|Michael Macy,Racial Bias|Racial Inequality|Impact of Recommendations|Platform Design|Sharing Economy,/pdf/9c8139b3d6c36b79694118dc3aa8590ceba7c8b9.pdf,,373,15390,https://www.dropbox.com/request/Ve4t6kWms5C7oHJIiq4P,1C
15,3,1C,Inequalities and bias,C,1,0,11.3,732,Adam Pah,Cross Walking Bias: How Data Recombination Reifies Bias in Criminal Sentencing,21161572,adamrpah@gmail.com,1.57142857,Kat Albrecht,courts|court records|data cross walks|crime|bias,/pdf/de7434561c8c79dbb10c8c10117ea35c26c8761b.pdf,Yes,270,286,https://www.dropbox.com/request/Ve4t6kWms5C7oHJIiq4P,1C
16,3,1C,Inequalities and bias,C,1,0,11.45,603,Nicola Fanton,Instructions (for All): On Differences and Biases in How-to Guides for Specific Audiences,21163220,nicola.fanton@ims.uni-stuttgart.de,1.38461538,Nicola Fanton|Agnieszka Falenska|Michael Roth,Instructions|Systematic Biases|Social Stereotypes|Targeting|Classification,/pdf/63146d6a1b8e74eb62ad92d296db9ed00daaa217.pdf,Yes,0,3503,https://www.dropbox.com/request/Ve4t6kWms5C7oHJIiq4P,1C
17,3,1C,Inequalities and bias,C,1,0,12,9,Zeyneb Nahide Kaya,Women in the Workplace: Analyzing Gender Biases in Corporate Email Communications,21176387,zeynebnkaya@icloud.com,1,Zeyneb Nahide Kaya,,/pdf/e4719a634e308e1ee4f7a0508868dddca0a6d0ed.pdf,Yes,30,0,https://www.dropbox.com/request/Ve4t6kWms5C7oHJIiq4P,1C
18,3,1C,Inequalities and bias,C,1,0,12.15,768,Matteo Magnani,YouTube as a visual digital intermediary in global climate communication,21164271,matteo.magnani@it.uu.se,1.33333333,Alexandra Segerberg|Matteo Magnani,YouTube|climate change communication|digital platforms|global|computer vision,/pdf/909d1c57c520ce09945b7d29577bb4dea9aebb0a.pdf,,7,7,https://www.dropbox.com/request/Ve4t6kWms5C7oHJIiq4P,1C
19,4,1D,Online discourse I,D,1,0,11,471,Roeland Dubè,A dynamic perspective on online news article reading,21162395,r.dubel@uva.nl,2,Damian Trilling|Roeland Dubèl|Rupert Kiddle|Anne C. Kroon|Zilin Lin|Mónika Simon|Susan Vermeer|Kasper Welbers|Mark Boukes,online news|log data|feedback loops|traffic sources,/pdf/47b998716837a08e72251093e1cb9bd0078b7851.pdf,,0,1039,https://www.dropbox.com/request/YMAeN9t0DoGx0rGwgSa7,1D
20,4,1D,Online discourse I,D,1,0,11.15,464,Sanjay Kairam,Estimating the Impact of Replies on First-Time Contributors in Online Communities: A Peer Encouragement-Based Approach,21175011,sanjay.kairam@gmail.com,2,Sanjay Kairam,online community|reddit|newcomer|instrumental variable|peer encouragement,/pdf/8692b665d1980949cc1fcae30c5604dbbf717ee8.pdf,,1048,1048,https://www.dropbox.com/request/YMAeN9t0DoGx0rGwgSa8,1D
21,4,1D,Online discourse I,D,1,0,11.3,618,Leonardo Castro Gonzalez,Who is driving the conversation? Analysing the nodality of British MPs and journalists on online platforms,21094599,lmcastrogonzalez@turing.ac.uk,2,Sukankana Chakraborty|Leonardo Castro-Gonzalez|Helen Margetts|Jonathan Bright,Nodality|Twitter|British Politics|Network Sciences|Information Theory,/pdf/196186820cb9d51baade28e1b0c77bf949d0cd7e.pdf,Yes,260,1001,https://www.dropbox.com/request/YMAeN9t0DoGx0rGwgSa9,1D
22,4,1D,Online discourse I,D,1,0,11.45,715,Helena Sophia Rauxloh,"The more news sources, the better for democracy? Diversity of information exposure and feelings of self-efficacy",21163077,helena.rauxloh@gesis.org,1.63636364,Helena Sophia Rauxloh|Lisa Merten|Heidi Schulze|Judith Moeller|Isabel Lerch,web tracking|information exposure|news sources|diversity|efficacy,/pdf/a6c43c402d889d54cac295eeadd6350c9828e94a.pdf,Yes,0,483,https://www.dropbox.com/request/YMAeN9t0DoGx0rGwgSa10,1D
23,4,1D,Online discourse I,D,1,0,12,804,Dylan Thurgood,You Are What You Read or Whom You Trust?,21163109,dylan.thurgood@oii.ox.ac.uk,1.33333333,Dylan Thurgood|Sebastian Stier,web tracking|news consumption|media trust|EU|immigration,/pdf/dc52c457e6e4bea31efa92615a19e8d33fabc4af.pdf,Yes,0,2628,https://www.dropbox.com/request/YMAeN9t0DoGx0rGwgSa11,1D
24,4,1D,Online discourse I,D,1,0,12.15,777,"Ardon Z. Shorr, Mark E Whiting",Matter Orders: Structural cues affect readers' interpretations independently of word choice,"21175460, 21175466",Ardon@princeton.edu,1.3,Ardon Z. Shorr|Mark E Whiting|Dafna Yavetz,emphasis|stance|structure|discourse|MTurk,/pdf/92604f6c46fd5fd03ca5ac0f88257ad80080c97e.pdf,Yes,0,0,https://www.dropbox.com/request/YMAeN9t0DoGx0rGwgSa12,1D
25,5,1E,Mobility and Urban Data Science I,E,1,0,11,191,Michael Szell,Computational Desire Line Analysis of Cyclists on the Dybbølsbro Intersection in Copenhagen,21167389,misz@itu.dk,2,Simon Martin Breum|Bojan Kostic|Michael Szell,urban data science|cycling|traffic behavior|human-centric planning,/pdf/bb0048bb1911d8ab13effcff2a9f1d4a9258743c.pdf,,3111,3111,https://www.dropbox.com/request/e7htyGyeoWfMs4CdGJG1,1E
26,5,1E,Mobility and Urban Data Science I,E,1,0,11.15,197,Ting Lian,Identify Urban Risk Factors for Bus Crashes Using Computer Vision Tools,21070390,tlian@connect.hku.hk,1.625,Zhuangyuan Fan|Becky P.Y. Loo|Ting Lian|Feiyang Zhang,transportation|crashes analysis|computer vision|pedestrian behavior|video analysis,/pdf/2dcc4557013439bf6f7dadb6c0fd47505b8ae0eb.pdf,Yes,299,340,https://www.dropbox.com/request/e7htyGyeoWfMs4CdGJG2,1E
27,5,1E,Mobility and Urban Data Science I,E,1,0,11.3,74,Massimiliano Luca,Understanding how Road Network Safety Impacts Cycling Behaviour,20934834,mluca@fbk.eu,1,Massimiliano Luca|Bruno Lepri|Antonio Bucchiarone|Annapaola Marconi|Simone Centellegher,Mobility|Urban Planning|GPS Traces|Human Behaviour,/pdf/e779e4825229be423ff4ee4e8bc88792dd108686.pdf,Yes,20,235,https://www.dropbox.com/request/e7htyGyeoWfMs4CdGJG3,1E
28,5,1E,Mobility and Urban Data Science I,E,1,0,11.45,73,Silvia De Sojo Caso,Understanding the gender gaps in employment and mobility using large-scale behavioral data,21203134,sdsc@dtu.dk,1.63636364,Silvia De Sojo Caso|Sune Lehmann|Laura Maria Alessandretti,human mobility|gender gaps|employment|smartphones|GPS data,/pdf/c7ee5cc5fe071333f3c7ac1554cf34a8be2ff986.pdf,Yes,0,0,https://www.dropbox.com/request/e7htyGyeoWfMs4CdGJG4,1E
29,5,1E,Mobility and Urban Data Science I,E,1,0,12,456,Ronaldo Menezes,Uncovering the differences and similarities between physical and virtual mobility,21175309,r.menezes@exeter.ac.uk,1.38461538,Surendra Hazarie|Hugo Barbosa|Adam Frank|Ronaldo Menezes|Gourab Ghoshal,Human Mobility|Human Behaviour Modelling|Virtual Mobility,/pdf/79aa2a4d4baa34326e12e5d4dd97ea90545a1a8f.pdf,,2084,2298,https://www.dropbox.com/request/e7htyGyeoWfMs4CdGJG5,1E
30,5,1E,Mobility and Urban Data Science I,E,1,0,12.15,744,Henrik Wolf,CoolWalks,21155996,henrik.wolf@tu-dresden.de,1.375,Henrik Wolf|Ane Rahbek Vierø|Michael Szell,urban data science|liveability|street networks|climate adaption|human mobility,/pdf/5eb15b4f5ce50d063b0a4c4cf4029c159c3b1162.pdf,,114,3111,https://www.dropbox.com/request/e7htyGyeoWfMs4CdGJG6,1E
31,6,1F,Nature and Climate ,F,1,0,11,588,Nicole Nisbett,How convincing are AI-generated moral arguments for climate action?,21097849,n.nisbett@leeds.ac.uk,1.3,Nicole Nisbett|Viktoria Spaiser,GPT-3|Moral Foundation Theory|climate communication|AI|climate action,/pdf/bf3cd2d5d5bc81ced7b603806737395462048223.pdf,Yes,3,712,https://www.dropbox.com/request/PPxziV5rNkLbCtmtY9Z6,1F
32,6,1F,Nature and Climate ,F,1,0,11.15,911,Kelton R Minor,Adverse weather amplifies social media activity,21163096,kelton.minor@columbia.edu,2,Kelton R Minor|Esteban Moro|Nick Obradovich,weather|social media|heat|climate|rain,/pdf/cd4135fee784181d356b2697d1c6c4171931f80d.pdf,Yes,625,2873,https://www.dropbox.com/request/PPxziV5rNkLbCtmtY9Z7,1F
33,6,1F,Nature and Climate ,F,1,0,11.3,760,Hannah-Marie Büttner,Activists preserving the (Digital Media) Environment - Advocacy Coalitions of Lutzerath,21174247,habu@uni-bremen.de,2,Hannah-Marie Büttner|Hendrik Meyer|Patrick Zerrer,climate protest|digital network analysis|topic modelling|advocacy coalitions,/pdf/1f61b2d665069cb3256a270254ec27df22b7ebdc.pdf,Yes,0,371,https://www.dropbox.com/request/PPxziV5rNkLbCtmtY9Z8,1F
34,6,1F,Nature and Climate ,F,1,0,11.45,66,Max Falkenberg,"The Evolution of Climate Scepticism on Twitter: Polarization, Hypocrisy, and the Musk Takeover",20990182,max.falkenberg@city.ac.uk,1.33333333,Max Falkenberg|Andrea Baronchelli,Social media|climate change|climate sceptics|polarization|hypocrisy,/pdf/72d7459ba5fc8afa8954d13daef0fcfa82122315.pdf,Yes,64,5970,https://www.dropbox.com/request/PPxziV5rNkLbCtmtY9Z9,1F
35,6,1F,Nature and Climate ,F,1,0,12,466,Giorgio Tripodi,Advances in negative emissions technologies generate heterogeneous knowledge spillovers,21175327,giorgio.tripodi@sns.it,1.33333333,Giorgio Tripodi|Francesco Lamperti|Andrea mina|Fabrizio Lillo|Roberto Mavilia|Francesca Chiaromonte,Science of science|Knowledge spillovers|Climate change|Networks|Innovation,/pdf/adb4658f4cb4b8bb9e8a1dc076198554b3b8f4fa.pdf,Yes,12,15254,https://www.dropbox.com/request/PPxziV5rNkLbCtmtY9Z10,1F
36,6,1F,Nature and Climate ,F,1,0,12.15,899,Kelton R Minor,Nature exposure is associated with reduced smartphone use,21163096,kelton.minor@columbia.edu,1.57142857,Kelton R Minor|Kristoffer Lind Glavind|Aaron J. Schwartz|Christopher Danforth|Sune Lehmann|Andreas Bjerre-Nielsen,Nature|smartphones|attention|screentime|greenspace,/pdf/1ab34d6015ef876648a7b996c39f5e7e8fb9785d.pdf,Yes,625,0,https://www.dropbox.com/request/PPxziV5rNkLbCtmtY9Z11,1F
37,7,1G,Epidemics,G,1,0,11,71,Michele Tizzani,Impact of tiered measures on social contact and mixing patterns of adults in Italy during the second wave of COVID-19,21097551,michele.tizzani@isi.it,1.11111111,Michele Tizzani|Daniela Paolotti|Pietro Coletti|Alessandro De Gaetano|Christopher I Jarvis|Amy Gimma|Kerry Wong|John W Edmunds|Philippe Beutels|Niel Hens,Keywords: COVID-19|contact matrices|non-pharmaceutical interventions|social contact patterns|disease outbreak,/pdf/5355c5bc998daa0187b7541a06489816c58a73e2.pdf,Yes,189,13048,https://www.dropbox.com/request/oZKOZctaRD12r3DLzvLN,1G
38,7,1G,Epidemics,G,1,0,11.15,78,Julia Koltai,Vaccination Homophily in Social Networks During the Covid-19 Pandemic,21175579,koltai.julia@tk.hu,1.08333333,Julia Koltai|Adam Stefkovics|Anna Sara Ligeti,ego-networks|network diary|homophily|vaccination|Covid19,/pdf/c6119eb803788058cb425ea5841ff3bf1aae93b0.pdf,,0,11,https://www.dropbox.com/request/oZKOZctaRD12r3DLzvLN,1G
39,7,1G,Epidemics,G,1,0,11.3,17,Marcin Waniek,Trading contact tracing efficiency for finding patient zero,21026474,mjwaniek@gmail.com,2,Marcin Waniek|Petter Holme|Katayoun Farrahi|Remi Emonet|Manuel Cebrian|Talal Rahwan,contact tracing|source detection|networks|diffusion|infection,/pdf/098ed25c93a47211121add82f8cf7ba2b1664157.pdf,,323,3124,https://www.dropbox.com/request/oZKOZctaRD12r3DLzvLN,1G
40,7,1G,Epidemics,G,1,0,11.45,190,Michele Tizzoni,Modeling adaptive forward-looking behavior in epidemics on networks,21162507,michele.tizzoni@unitn.it,2,Lorenzo Amir Nemati Fard|Michele Starnini|Michele Tizzoni,epidemic modeling|epi-economics|forward-looking behaviour|complex networks,/pdf/18527c523496d2ab6cab3e24fbf5bfe236e49b81.pdf,,3344,3344,https://www.dropbox.com/request/oZKOZctaRD12r3DLzvLN,1G
41,7,1G,Epidemics,G,1,0,12,204,Alessandro De Gaetano,Behavioural changes associated to the COVID-19 vaccine: Evidence from a cross-national Facebook survey,21105142,alessandro.degaetano@isi.it,1.08333333,Alessandro De Gaetano|Daniela Paolotti|Daniela Perrotta|Nicola Perra|Nicolò Gozzi|Paolo Bajardi,COVID-19|Vaccines|Human behaviours|Facebook surveys|Multivariate analysis,/pdf/3b4b1e56830e0616eec1a4f368e58d3f14a8ef7d.pdf,Yes,4,2476,https://www.dropbox.com/request/oZKOZctaRD12r3DLzvLN,1G
42,7,1G,Epidemics,G,1,0,12.15,330,Ryota Kobayashi,Evolution of Public Opinion on COVID-19 Vaccination in Japan,21119087,r-koba@k.u-tokyo.ac.jp,1.375,Ryota Kobayashi|Yuka Takedomi|Yuri Nakayama|Towa Suda|Takeaki Uno|Takako Hashimoto|Masashi Toyoda|Naoki Yoshinaga|Masaru Kitsuregawa|Luis E C Rocha,COVID-19|vaccination|Twitter|public opinion|longitudinal study,/pdf/ee650869f5b7014408511a811551d903998293c7.pdf,,198,105,https://www.dropbox.com/request/oZKOZctaRD12r3DLzvLN,1G
43,8,1H,Education,H,1,0,11,339,Katie Spoon,"Quantifying the origins and impacts of book bans in U.S. public schools, 2021 - 2022",21162697,katherine.spoon@colorado.edu,2,Katie Spoon|Isabelle Langrock|Jack LaViolette|Marcelo Silva,book bans|politics|education|censorship|polarization,/pdf/0ab699d22ae810d60f038e4848fd07ea01c2cb96.pdf,Yes,119,54,https://www.dropbox.com/request/okCK5uJudSwhIPUkLoZC,1H
44,8,1H,Education,H,1,0,11.15,392,"Kristina Gligoric, Tiziano Piccardi","In-class Data Analysis Replications: Feasibility, Student Learning Outcomes, and Challenges","20986319, 21119061",kristinagligoric.ns@gmail.com,1.625,Kristina Gligoric|Tiziano Piccardi|Jake M. Hofman|Robert West,reproducibility|data analysis|education|open science|citizen science,/pdf/12dc47dcddb6faa73262178915659d6f4bdc46bb.pdf,Yes,0,478,https://www.dropbox.com/request/okCK5uJudSwhIPUkLoZC,1H
45,8,1H,Education,H,1,0,11.3,891,Zhen Xu,Intersectional Inequalities in Online Communication Among Postsecondary Learners,21070891,zx2393@tc.columbia.edu,1.63636364,Renzhe Yu|Sky CH-Wang|Zhen Xu|Zhuojian Wei,Online Education|Discussion Forum|Inequality|Intersectionality|Natural Language Processing,/pdf/c66eef557c477d7d452d5c0e8473201d79dd1636.pdf,Yes,825,1,https://www.dropbox.com/request/okCK5uJudSwhIPUkLoZC,1H
46,8,1H,Education,H,1,0,11.45,427,Nalette Brodnax,Top-Down Discipline: The Role of Carceral Ideology in US Public Schools' Disciplinary Regimes,21059090,nalette.brodnax@georgetown.edu,1.7,Nalette Brodnax,school discipline|racial inequality|education policy|text as data,/pdf/8b7406da03a951992676c91df35f94dbaea96194.pdf,,6,6,https://www.dropbox.com/request/okCK5uJudSwhIPUkLoZC,1H
47,8,1H,Education,H,1,0,12,183,Nabeel Gillani,Impacts of Differential Privacy on Fostering more Racially and Ethnically Diverse Elementary Schools,20986593,n.gillani@northeastern.edu,1.4,Keyu Zhu|Nabeel Gillani|Pascal Van Hentenryck,Education|Inequality|Socioeconomic Diversity|Differential Privacy|Optimization,/pdf/2848fcc96dc36abca4701796749702a45ad7599a.pdf,Yes,474,17441,https://www.dropbox.com/request/okCK5uJudSwhIPUkLoZC,1H
48,8,1H,Education,H,1,0,12.15,647,Melanie Oyarzun,Homophily and heterogeneity of students' preferences increase persistence in STEM,21158465,moyarzunw@udd.cl,1.1,Melanie Oyarzun|Mariana Macedo|Cristian E Candia|Cesar A Hidalgo,Higher Education Persistence|Gender Inequality|Persistence in STEM|Network Science|Complex Systems,/pdf/6e7bd64411af5d9d78ca45d4fefe799face46ef9.pdf,Yes,35,21031,https://www.dropbox.com/request/okCK5uJudSwhIPUkLoZC,1H
49,9,2A,Misinformation,A,1,1,14.3,301,Juniper L Lovato,Diverse Misinformation: Impacts of Human Biases on Detection of Deepfakes on Networks,20986062,juniper.lovato@uvm.edu,1.27272727,Juniper L Lovato|Laurent Hebert-Dufresne|Jonathan St-Onge|Randall Harp|Gabriela Salazar Lopez|Sean P. Rogers|Ijaz Ul Haq|Jeremiah Onaolapo,Privacy|Misinformation|Deepfakes|Social Networks|Survey study|Survey study,/pdf/f141cd667b3b7c82c94d445a8f95fff676139cd0.pdf,Yes,10,440,https://www.dropbox.com/request/fEkDMPT01RM3LBnc8PpG,2A
50,9,2A,Misinformation,A,1,1,14.45,404,Kateryna Kasianenko,Assembling coordinated patterns in the study of dis/misinformation campaigns,21163110,kateryna.kasianenko@hdr.qut.edu.au,1.35714286,Guangnan Zhu|Kateryna Kasianenko|Shima Saniei|Uttama Barua|George Gyamfi,Disinformation|Coordinated Activity|Social Network|Social Media|COVID-19,/pdf/8c1c026414d2a58d26fe4713029c6e88ad31d62d.pdf,Yes,2,51,https://www.dropbox.com/request/fEkDMPT01RM3LBnc8PpG,2A
51,9,2A,Misinformation,A,1,1,15,524,Segun Aroyehun,From alternative conceptions of honesty to alternative facts in communications by U.S. politicians,21123797,segun.aroyehun@uni-konstanz.de,1.42857143,Jana Lasser|Segun Aroyehun|Fabio Carella|Almog Simchon|David Garcia|Stephan Lewandowsky,misinformation|political communication|populism|social media|text analysis,/pdf/0ea237fc9db30ecce943dac19f8fb1a55290e4ba.pdf,,165,21537,https://www.dropbox.com/request/fEkDMPT01RM3LBnc8PpG,2A
52,9,2A,Misinformation,A,1,1,15.15,814,Ruth Elisabeth Appel,Partisan conflict over content moderation is more than disagreement about facts,21153752,rappel@stanford.edu,1.66666667,Ruth Elisabeth Appel|Jennifer Pan|Margaret Roberts,social media|partisanship|censorship|content moderation|misinformation,/pdf/3d2d779c1b406c825d3efe5d9250b1f7e0a34bb6.pdf,Yes,38,7294,https://www.dropbox.com/request/fEkDMPT01RM3LBnc8PpG,2A
53,9,2A,Misinformation,A,1,1,15.3,859,Bao Tran Truong,Vulnerabilities of the Online Public Square to Manipulation,21162560,baotruon@iu.edu,1.63636364,Bao Tran Truong|Xiaodan Lou|Alessandro Flammini|Filippo Menczer,social media|agent-based simulation|misinformation|platform policy|moderation,/pdf/0baae0e181003c28f1723cc735e2eea241ae3c86.pdf,Yes,369,24718,https://www.dropbox.com/request/fEkDMPT01RM3LBnc8PpG,2A
54,9,2A,Misinformation,A,1,1,15.45,36,Jason C Coronel,Predicting when information will be remembered: A machine learning and eye-tracking approach to the study of misinformation,21163682,coronel.4@osu.edu,1.33333333,Jason C Coronel|Matthew Donald Sweitzer|Shannon Poulsen,misinformation|memory|eye tracking|machine learning|prediction,/pdf/d7472969a67eac8dc94558a37e8a2d77cfbd8184.pdf,,173,170,https://www.dropbox.com/request/fEkDMPT01RM3LBnc8PpG,2A
55,10,2B,Social Networks II,B,1,1,14.3,439,Milena Tsvetkova,Millions of Brand Co-visits Reveal Socioeconomic Status Boundaries in Daily Consumption ,21086813,m.tsvetkova@lse.ac.uk,2,Yuanmo He|Milena Tsvetkova,social networks|inequality|socioeconomic status|consumption behavior|mobility,/pdf/a5d542b6a4389ebbc2c4d53bc0e73ee66031e4e0.pdf,Yes,522,522,https://www.dropbox.com/request/9nytqMM919Es5Wec6ES4,2B
56,10,2B,Social Networks II,B,1,1,14.45,449,Kathyrn Fair,Emerging Labour Flow Networks,21162622,kfair@turing.ac.uk,1.44444444,Kathyrn Fair|Omar Guerrero,labour mobility|labour flow networks|labour market shocks|agent-computing model|emergence,/pdf/1337996b0b795a95d96205c6b6c38c4160d058ec.pdf,Yes,68,285,https://www.dropbox.com/request/9nytqMM919Es5Wec6ES5,2B
57,10,2B,Social Networks II,B,1,1,15,620,Gerardo Iñiguez,Universal patterns in egocentric communication networks,21158151,gerardo.iniguez@tuni.fi,2,Gerardo Iñiguez|Sara Heydari|János Kertész|Jari Saramäki,Quantitative sociology|personal networks|tie strength. communication dynamics|modelling,/pdf/32d336fe1b4f945eb973386f74b4cd78929e5342.pdf,,893,12419,https://www.dropbox.com/request/9nytqMM919Es5Wec6ES6,2B
58,10,2B,Social Networks II,B,1,1,15.15,554,Johanna Einsiedler,Persistance of Social Ties from Informal Group Interactions,21031280,johanna.einsiedler@sodas.ku.dk,1,Johanna Einsiedler|Nikolaj Arpe Harmon|David Dreyer Lassen|Jolien Cremers|Andreas Bjerre-Nielsen,social networks|group formation|sensor data|peer effects|causal inference,/pdf/a307f54e31e27fa0d0926c052b00b3f87ff6e178.pdf,Yes,16,0,https://www.dropbox.com/request/9nytqMM919Es5Wec6ES7,2B
59,10,2B,Social Networks II,B,1,1,15.3,235,Alexander J Gates,Connected Reality: Virtual Immersion in Social Networks,21099651,agates@virginia.edu,1.4,Alexander J Gates|Alice Grishchenko,social networks|science of science|augmented reality|data visualization,/pdf/aee1c97963775eb9f0e738b4cedf8468e45bba0d.pdf,,913,42,https://www.dropbox.com/request/9nytqMM919Es5Wec6ES8,2B
60,10,2B,Social Networks II,B,1,1,15.45,254,Sam Zhang,Minority group size moderates inequity-reducing strategies in homophilic networks,21202251,sam.zhang@colorado.edu,1.35714286,Ana Macanovic|Sam Zhang,social networks|network models|minority groups|inequality|complex systems,/pdf/fe46bb6fe5fee70b900c37ba2c8d9dbcd76954e9.pdf,Yes,13260,13260,https://www.dropbox.com/request/9nytqMM919Es5Wec6ES9,2B
61,11,2C,Polarization II,C,1,1,14.3,902,Veniamin Veselovsky,Wikipedia's Polarization on Reddit,21124577,veniamin.veselovsky@epfl.ch,1,Veniamin Veselovsky|Ashton Anderson,Community embeddings|Wikipedia|polarization|culture wars|Reddit,/pdf/971246f9d7a9599592996e81755c69a19e49c6c9.pdf,Yes,17,2877,https://www.dropbox.com/request/EX8LiVWPZlmXZjj7nMl2,2C
