id,session_number,session_id,session_name,room,day,day_part,time,submission_id,presenter_name,title,deltager_id,email,weighted_average_rating,authors,keywords,pdf,early_career_scholar,presenter_citations,last_authors_citations,upload_link,session_id
122,21,3E,Mobility and Urban Data Science III,E,2,0,11.15,482,Babak Heydari,Mobility Networks and Pandemic Analytics: How much can we gain by using complex network models?,21162516,b.heydari@northeastern.edu,1.36363636,Qingtao Cao|Babak Heydari,Complex Networks|Geospatial Modeling|Behavioral Response|Mobility Data|Pandemic Modeling,/pdf/1302bb095fe5ca575bd2fd436449e0cf18440f48.pdf,Yes,541,541,https://www.dropbox.com/request/wdeCGaW7Sz69sosSyDRB,3E
123,21,3E,Mobility and Urban Data Science III,E,2,0,11.3,611,Giovanni Mauro,Generating Mobility Networks with Generative Adversarial Networks,21103332,giovanni.mauro@phd.unipi.it,1.63636364,Giovanni Mauro|Massimiliano Luca|Antonio Longa|Bruno Lepri|Luca Pappalardo,Human Mobility|Flow Generation|Mobility Networks|GANs,/pdf/c0ad7142356f2066e55af906b123a889cacd35c3.pdf,Yes,328,2644,https://www.dropbox.com/request/wdeCGaW7Sz69sosSyDRB,3E
124,21,3E,Mobility and Urban Data Science III,E,2,0,11.45,233,Maddalena Conte,Moving to opportunity through coworker networks,21046673,maddalena.conte@ensae.fr,1.5,Maddalena Conte,migration|coworker networks|information|labor market segmentation|economic geography,/pdf/32ce904e225c930b4f274ee2d23b9bea505637d7.pdf,Yes,152,152,https://www.dropbox.com/request/wdeCGaW7Sz69sosSyDRB,3E
125,21,3E,Mobility and Urban Data Science III,E,2,0,12,135,Nail Furkan Bashan,Network analysis reveals fare-free shared bike system improves community integration in Boston,21161531,bashan.n@northeastern.edu,2,Nail Furkan Bashan|Qi Wang,,/pdf/d7ffac88d01e84684c31a5995d06547c1f718890.pdf,Yes,0,8106,https://www.dropbox.com/request/wdeCGaW7Sz69sosSyDRB,3E
126,21,3E,Mobility and Urban Data Science III,E,2,0,12.15,731,Kishore Vasan,Nature of individual exploration in blockchain-governed virtual environments,21162668,viprankishore@gmail.com,1.5,Kishore Vasan,metaverse|NFT|mobility|human behavior|network,/pdf/281432cd52b3e1f90dd5a4d2d1b07fbc74c68df3.pdf,Yes,88,88,https://www.dropbox.com/request/wdeCGaW7Sz69sosSyDRB,3E
127,22,3F,Teams and knowledge,F,2,0,11,308,Xinlan Emily Hu,Tasks Beyond Taxonomies: A Multidimensional Embedding Space of Team Tasks,21124417,amaatouq@mit.edu,1.57142857,Xinlan Emily Hu|Linnea Gandhi|Mark E Whiting|Abdullah Almaatouq|Duncan J. Watts,teams|groups|tasks|experimental design|generalizability,/pdf/1addb952caba631f156c5a0e8b96e2242372368f.pdf,Yes,10,80721,https://www.dropbox.com/request/FkO8eOrEK46Lf3lY9xh1,3F
128,22,3F,Teams and knowledge,F,2,0,11.15,508,Lillio Mok,Challenging but Connective: Large-Scale Characteristics of Cross Time Zone Meetings,21176417,lillio@cs.toronto.edu,1.6,Lillio Mok|Lu Sun|Shilad Sen|Bahareh Sarrafzadeh,Collaboration|remote work|time zones|connectivity|organizational science,/pdf/152979b841aa09a2cd87b07d00f392fcebea616a.pdf,Yes,9,92,https://www.dropbox.com/request/FkO8eOrEK46Lf3lY9xh2,3F
129,22,3F,Teams and knowledge,F,2,0,11.3,824,James P Houghton,High-throughput experiments in small-group deliberation,21207874,jameshou@seas.upenn.edu,1.3,James P Houghton|Duncan J Watts,Virtual-lab|High-throughput Experiments|Deliberation|Small Groups,/pdf/4ebeb767550a7a0d57444c135b6691cdbb0a8b55.pdf,Yes,163,80721,https://www.dropbox.com/request/FkO8eOrEK46Lf3lY9xh3,3F
130,22,3F,Teams and knowledge,F,2,0,11.45,423,Yuzuki Takahashi,Emergent patterns of intra-team relationships and their impact on team performance: an analysis of teamwork for idea generation,21117545,melody07flute08@gmail.com,1.09090909,Yuzuki Takahashi|Hayato Misumi|Mikiko Shimaoka|Tomomi Kito,teamwork|idea-generation|emergence|leadership|conversation analysis,/pdf/2e4801acb63cd9f16c847787f90c6f0ec40da221.pdf,,0,349,https://www.dropbox.com/request/FkO8eOrEK46Lf3lY9xh4,3F
131,22,3F,Teams and knowledge,F,2,0,12,755,Tzu-Chi Yen,Aspiration of prestige in the selection of peer institutions,21162579,tzuchi.yen@colorado.edu,1.57142857,Tzu-Chi Yen|Kate L. Wootton|Aaron Clauset|Daniel Larremore,status maintenance|signaling|meritocracy|stratified models|network analysis,/pdf/5ee08a94d11885da99dee10594bb236653e4b295.pdf,Yes,0,5062,https://www.dropbox.com/request/FkO8eOrEK46Lf3lY9xh5,3F
132,22,3F,Teams and knowledge,F,2,0,12.15,918,Ezequiel Lopez Lopez,How do people navigate their ideas during problem scoping of open-ended ill-defined problems? A knowledge graph-based approach,21163105,lopez@mpib-berlin.mpg.de,1.57142857,Ezequiel Lopez Lopez|Stefan M. Herzog,knowledge exploration|problem scoping|open-ended problems|ill-defined problems|knowledge graphs,/pdf/d0987617cf480ca75a23555df759f34700f55794.pdf,Yes,11,1582,https://www.dropbox.com/request/FkO8eOrEK46Lf3lY9xh6,3F
133,23,3G,Health,G,2,0,11,798,Sanja Scepanovic,The Online Medical Taxonomy,21209063,sanja.scepanovic@nokia-bell-labs.com,1.3,Sanja Scepanovic|Luca Maria Aiello|Ke Zhou|Daniele Quercia,NLP|social media analysis|health discussions|online medical taxonomy,/pdf/9b0369d3b15c69d8c000db12fa91947993e2a555.pdf,,309,6450,https://www.dropbox.com/request/gNwIg2KkEKsOxEn9tWHF,3G
134,23,3G,Health,G,2,0,11.15,94,"Wanqi Hu, Xinran Wang",Trend of Depression in Online Mutual Help Group for Major Depressive Disorder by a Two-step NLP Method,"21026349, 21026341",wanqi.hu.929@gmail.com,1.55555556,Wanqi Hu|Xinran Wang,Major depressive disorder|Mutual help group|BiLSTM|Dictionary method|Chinese,/pdf/a3912e47b556ada9f7d61d0f825758b2671cb2a3.pdf,Yes,0,15443,https://www.dropbox.com/request/gNwIg2KkEKsOxEn9tWHF,3G
135,23,3G,Health,G,2,0,11.3,596,Yunhao Yuan,Does Papageno Effect Occur on Social Media?,21155927,Yunhao.Yuan@aalto.fi,1.66666667,Yunhao Yuan|Koustuv Saha|Barbara Keller|Erkki Tapio Isometsä|Talayeh Aledavood,social media|mental health|suicidal ideation|causal inference|Papageno effect,/pdf/a5d9b80ed7c8b30b266c771557dbec5ff029b64c.pdf,Yes,335,425,https://www.dropbox.com/request/gNwIg2KkEKsOxEn9tWHF,3G
136,23,3G,Health,G,2,0,11.45,757,Artem Kuriksha,Interventions and Illegal Drug Use: Evidence from a Darknet Marketplace,21176404,kuriksha@sas.upenn.edu,1.71428571,Artem Kuriksha|Priyanka Goonetilleke|Anastasia Karpova|Peter Meylakhs,illicit drugs|public health|dark web marketplaces|demand estimation|crime,/pdf/ca120c3fbe398a622b04ddc22c12459be1145815.pdf,Yes,25,275,https://www.dropbox.com/request/gNwIg2KkEKsOxEn9tWHF,3G
137,23,3G,Health,G,2,0,12,922,Sebastian Mildiner Moraga,Classics never die: a novel multilevel hidden Markov model to uncover mood states in patients with bipolar disorder,21164672,s.mildinermoraga@uu.nl,2,Sebastian Mildiner Moraga|Fionneke M Bos|Bennard Doornbos|Richard Bruggeman|Lian van der Krieke|Evelien Snippe|Emmeke Aarts,Bayesian statistics|hidden Markov model|dynamics of behaviour|interpretable machine learning|bipolar disorder,/pdf/03975dffd3c2ccdba55bdc9d12eb9ef4bf28846d.pdf,Yes,0,789,https://www.dropbox.com/request/gNwIg2KkEKsOxEn9tWHF,3G
138,23,3G,Health,G,2,0,12.15,574,Elizaveta Sivak,Establishing Prediction Benchmarks of Fertility Outcomes for 12 European Countries,21034586,e.sivak@rug.nl,1,Elizaveta Sivak|Malvina Nissim|Gert Stulp,benchmarking|fertility|machine learning|predictability of life outcomes|prediction in social sciences,/pdf/565e54df2c64f69a6ec8aa389bb666107138af9f.pdf,Yes,100,1881,https://www.dropbox.com/request/gNwIg2KkEKsOxEn9tWHF,3G
139,24,3H,Methods and theory,H,2,0,11,743,Frederik Andersen,Confirmation trees: a simple strategy for producing hybrid intelligence,21070568,frda@sam.sdu.dk,1.33333333,Frederik Andersen|Pantelis P. Analytis|Diana Verdes|Kristian Peter Lorenzen|Julian Berger|Ralf Kurvers,hybrid intelligence|neural networks|decision trees|collective intelligence|medical decision-making,/pdf/c92689f51a827cf3ec7c853d6a1245e7cdcebfa2.pdf,,7,2416,https://www.dropbox.com/request/lVtziYAwBqYMNqNRjGQK,3H
140,24,3H,Methods and theory,H,2,0,11.15,629,Elias Najarro,"``Let them learn"": an ABM framework with adaptable agents",21097088,claire.glanois@gmail.com,1.4,Elias Najarro|Claire Glanois|Louisa Jane Di Felice|Djordje Grbic,agent-based model|multi-agent reinforcement learning|complex systems|multi-party systems|energy networks,/pdf/370508fdfab12fc4c7db117e3700f0b43ef8010d.pdf,Yes,112,548,https://www.dropbox.com/request/lVtziYAwBqYMNqNRjGQK,3H
141,24,3H,Methods and theory,H,2,0,11.3,714,Meysam Alizadeh,Comparing Methods of Creating a Random Sample of Twitter Users from a Country,21147511,alizadeh@ipz.uzh.ch,1.58333333,Meysam Alizadeh|Darya Zare|Mohammadhadi Aliahmadi|Mael Kubli|Sarvenaz Ebrahimi|Fabrizio Gilardi,Twitter|Sampling|Data Quality|Nationally Representative|Twitter API,/pdf/60b34c3991292080c52610bccb09d10fb5605f1e.pdf,,325,4398,https://www.dropbox.com/request/lVtziYAwBqYMNqNRjGQK,3H
142,24,3H,Methods and theory,H,2,0,11.45,642,Jaime Pérez,Causality Guiding Survey Analysis: A Use Case on Cyberbullying,21172134,Jperezs@comillas.edu,1.33333333,Jaime Pérez|Edmond Awad|Gregorio López|Mario Castro,Causality|DAG|Bayesian Statistics|Cyberbullying|Adolescents,/pdf/766326c80d72804f12cae3e4389f1f39d5916b3c.pdf,Yes,299,85,https://www.dropbox.com/request/lVtziYAwBqYMNqNRjGQK,3H
143,24,3H,Methods and theory,H,2,0,12,613,Daniel Valdenegro,"NRobust: A multiversal library with model selection, averaging, and out-of-sample analysis",21133605,daniel.valdenegro@demography.ox.ac.uk,2,Daniel Valdenegro|Charles Rahal,Multiverse|Specification-Curves|Robustness|Reproducibility|Selection and Averaging,/pdf/cc2576c0d020eaca459fe51153a6cea8f3a9008d.pdf,Yes,305,1178,https://www.dropbox.com/request/lVtziYAwBqYMNqNRjGQK,3H
144,24,3H,Methods and theory,H,2,0,12.15,687,Joel Harrison Suss,Estimating sub-national wealth inequality in the US using ensemble learning,21026237,j.suss@lse.ac.uk,1.4,Joel Harrison Suss|Dylan Connor|Tom Kemeny,Ensemble methods|machine learning|geography|economic inequality|wealth,/pdf/69ee56fa17bcc2e200d00c1688313c2efb67b98c.pdf,Yes,27,0,https://www.dropbox.com/request/lVtziYAwBqYMNqNRjGQK,3H
145,25,4A,NLP and society II,A,2,1,14.3,829,Junsol Kim,Predicting Public Opinions through the Integration of Large Language Models and Nationally Representative Surveys,21102490,junsol@uchicago.edu,1.5,Junsol Kim|Byungkyu Lee,public opinion|social survey|large language model|artificial intelligence|machine learning,/pdf/725a5c9b811645343ce8e099cc2379b67c229b73.pdf,Yes,43,524,https://www.dropbox.com/request/LPEyRxCY4YJsuOM9vXVK,4A
146,25,4A,NLP and society II,A,2,1,14.45,924,Erkan Gunes,Zero-Shot Multiclass Classification of Policy Documents with Large Language Models,21163386,ergu@dps.aau.dk,1.71428571,Erkan Gunes|Christoffer Koch Florczak,Large Language Models|Policy Agendas|Text Classification|Natural Language Processing|Public Policy,/pdf/a1efd96ce6c0981a67a5c866dd16e9318f6b4999.pdf,Yes,4683,0,https://www.dropbox.com/request/LPEyRxCY4YJsuOM9vXVK,4A
147,25,4A,NLP and society II,A,2,1,15,469,Sonja M Schmer-Galunder,Fostering Online Civil Sanctuaries with Theory-Informed Automated Content Moderation,21208236,sgalunder@sift.net,1.66666667,Vasanth Sarathy|Sonja M Schmer-Galunder|Dan Thomsen|Laurel Bobrow|Richard Freedman,interactive journalistic moderation|promoting prosociality|moral disengagement|large language models|sensor fusion,/pdf/09ec442526a0e97887b8e6b50d61cb5d1f3dd10d.pdf,Yes,0,9128,https://www.dropbox.com/request/LPEyRxCY4YJsuOM9vXVK,4A
148,25,4A,NLP and society II,A,2,1,15.15,544,Sanja Scepanovic,Positive Stress in Companies,21209063,sanja.scepanovic@nokia-bell-labs.com,1.7,Sanja Scepanovic|Marios Constantinides|Daniele Quercia,positive stress|company culture|NLP|online reviews|social media analysis,/pdf/8f44f4301501669316e6e00788372fe0b62ca5f0.pdf,,309,6450,https://www.dropbox.com/request/LPEyRxCY4YJsuOM9vXVK,4A
149,25,4A,NLP and society II,A,2,1,15.3,368,Zachary Pangan,100-Bot Convo: Social Media Simulation Using a Pre-Trained Language Model-Based \Agent Network,21163699,pangan.zachary7@gmail.com,1,Zachary Pangan|Eiji Aramaki|Shoko Wakamiya|Kongmeng Liew|Shuntaro Yada|Wan Jou She,discourse simulation|generative pre-trained language models|natural language generation|agent-based simulation|information diffusion,/pdf/8af1c36ccca9c6b903eeb96bb1700a410de66896.pdf,Yes,0,61,https://www.dropbox.com/request/LPEyRxCY4YJsuOM9vXVK,4A
150,25,4A,NLP and society II,A,2,1,15.45,120,Alessandro Gambetti,AI Crowdturfing on Yelp: Identifying Patterns in Machine-Generated Fake Reviews,21174926,gambetti.alessandro@novasbe.pt,1,Alessandro Gambetti|Qiwei Han,AI-generated Content|Fake Review Detection|GPT|Social Media|Natural Language Processing,/pdf/a308b33f62ebeb4e1957c08f1d7ce86e258b1ff8.pdf,Yes,8,509,https://www.dropbox.com/request/LPEyRxCY4YJsuOM9vXVK,4A
151,26,4B,Social Media III,B,2,1,14.3,903,Veniamin Veselovsky,Assessing the Impacts of COVID-19 on Reddit,21124577,veniamin.veselovsky@epfl.ch,1.4,Veniamin Veselovsky|Ashton Anderson,COVID-19|online communities|social platform change|language evolution|Reddit,/pdf/be4ac33fdfbad0861fe38cf8d2e9b675a49fc797.pdf,Yes,17,2877,https://www.dropbox.com/request/k75OS8zXdC6ZfRqywQRY,4B
152,26,4B,Social Media III,B,2,1,14.45,571,Rupert Tibor Kiddle,Leaves in the wind: identifying passivity in individual news selections via digital trace data,21162464,r.t.kiddle@uva.nl,1.5,Rupert Tibor Kiddle|Anne Kroon|Kasper Welbers|Damian Trilling,News Consumption|Recommenders|Social Media|User Agency|Digital Traces,/pdf/eb9442cd644506cab7636a87975e392f67a5819d.pdf,Yes,0,2012,https://www.dropbox.com/request/k75OS8zXdC6ZfRqywQRY,4B
153,26,4B,Social Media III,B,2,1,15,683,Satoshi Tohda,How Faithful are Social Media Posts in Representing News Articles?,21126198,tohda@tkl.iis.u-tokyo.ac.jp,1.33333333,Satoshi Tohda|Naoki Yoshinaga|Masashi Toyoda,Social Media|Fact-Checking|Rumour Detection|Twitter|COVID-19,/pdf/39afec6c5909f1ec61ce569cd3fbf172a0929e4c.pdf,Yes,42,3413,https://www.dropbox.com/request/k75OS8zXdC6ZfRqywQRY,4B
154,26,4B,Social Media III,B,2,1,15.15,697,Regina Widjaya,The alternative social media site ecosystem,21058764,rwidjaya@pewresearch.org,1.33333333,Regina Widjaya|Galen Stocking|Aaron Smith,social media|alt-right|misinformation|free speech|closed data ecosystem,/pdf/1be90ac5a0e8a7b99ae41bfeccb15c903eb2f2ef.pdf,,2,2269,https://www.dropbox.com/request/k75OS8zXdC6ZfRqywQRY,4B
155,26,4B,Social Media III,B,2,1,15.3,65,Amin Mekacher,The Cross-platform Consequences of Deplatforming on Social Media,21119842,max.falkenberg@city.ac.uk,1.61538462,Amin Mekacher|Max Falkenberg|Andrea Baronchelli,Social media|deplatforming|cross-platform|toxicity|polarization,/pdf/0faa53e9e1bedfaee0f5b85be0cfc3ff6b89abd3.pdf,Yes,34,5970,https://www.dropbox.com/request/k75OS8zXdC6ZfRqywQRY,4B
156,26,4B,Social Media III,B,2,1,15.45,535,Giuseppe Russo,Understanding Online Migration Decisions Following the Banning of Radical Communities,21176360,russog@ethz.ch,1.3,Giuseppe Russo|Manoel Horta Ribeiro|Giona Casiraghi|Luca Verginer,deplatforming|online communities|Reddit|observational studies|migration,/pdf/621e5af77e39ed4dfb4020ad0713affefca6208c.pdf,Yes,782,111,https://www.dropbox.com/request/k75OS8zXdC6ZfRqywQRY,4B
157,27,4C,Science of science II,C,2,1,14.3,76,Fengyuan Michael Liu,"Non-White scientists appear on fewer editorial boards, spend more time under review, and receive fewer citations",21025818,fl1092@nyu.edu,1.7,Fengyuan Michael Liu|Talal Rahwan|Bedoor Alshebli,science of science|race|inequality|peer review|acceptance delay,/pdf/02d13c82369b59a06ecd475265e4afc32ae02a75.pdf,Yes,58,571,https://www.dropbox.com/request/KhRwWHTUH2SZswYKTRlq,4C
158,27,4C,Science of science II,C,2,1,14.45,377,Sylvain Fontaine,A pattern of diffusion of artificial intelligence in science: the development of an AI scientific specialty in neuroscience,21088787,sylvain.fontaine@cnrs.fr,1.66666667,Sylvain Fontaine|Floriana Gargiulo|Michel Dubois|Paola Tubaro,Science of science|scientometrics|Artificial Intelligence|knowledge diffusion|technological specialization,/pdf/248ebb26c9fa94ce0921df75d629c28a21545cfc.pdf,Yes,18,897,https://www.dropbox.com/request/KhRwWHTUH2SZswYKTRlq,4C
159,27,4C,Science of science II,C,2,1,15,592,Jose Miguel Cordova,Signature Trajectories in the Multiplatform Diffusion of Science ,21158453,josecordova2027@u.northwestern.edu,1.45454545,Jose Miguel Cordova|Emoke-Agnes Horvat|Daniel Romero,Science of Science|Science on the Web|Multiplatform Diffusion|Science Communication|Science Diffusion.,/pdf/7345795fded5a7fae2a11ba89f2b9d7e2f2b1576.pdf,Yes,282,24,https://www.dropbox.com/request/KhRwWHTUH2SZswYKTRlq,4C
160,27,4C,Science of science II,C,2,1,15.15,105,Aliakbar Akbaritabar,A global bibliometric perspective on the social structure of science,21053084,akbaritabar@gmail.com,0.92307692,Aliakbar Akbaritabar|Andres F. Castro Torres|Vincent Lariviere|Cassidy R. Sugimoto,bibliometric data|research productivity|scientific collaboration|scientific mobility|scholarly impact and citations,/pdf/f1d0cb4844c6ee0bbc02e63cbab81658a135e3d2.pdf,Yes,213,9578,https://www.dropbox.com/request/KhRwWHTUH2SZswYKTRlq,4C
161,27,4C,Science of science II,C,2,1,15.3,576,Erin Walk,Scholarly migration and collaboration worldwide: A word embedding representation,21105755,akbaritabar@gmail.com,0.72727273,Erin Walk|Aliakbar Akbaritabar,Migration of scholars|Scientific collaboration|Bibliometric data|Word embedding vectors,/pdf/f01c5a735f563e6fde5633cfed917beccd815613.pdf,Yes,2,213,https://www.dropbox.com/request/KhRwWHTUH2SZswYKTRlq,4C
162,27,4C,Science of science II,C,2,1,15.45,807,Sam Zhang,Changes in variance and the canonical faculty productivity trajectory,21202251,sam.zhang@colorado.edu,1.33333333,Sam Zhang|Nicholas LaBerge|Daniel Larremore|Aaron Clauset,scholarly productivity|science careers|academic workforce,/pdf/dc536ba91c3a0b4c17a08505cb54da5611b8c216.pdf,Yes,13260,26848,https://www.dropbox.com/request/KhRwWHTUH2SZswYKTRlq,4C
163,28,4D,Economic complexity II,D,2,1,14.3,154,Edmond Awad,Mapping charitable giving preferences from 3 million decisions worldwide,21172135,edmondawad@gmail.com,1.66666667,Edmond Awad|Indrajeet Patil|Erez Yoeli|Iyad Rahwan|Zoe K. Rahwan,charitable giving|heterogeneity|serious game|cross-cultural|research methods,/pdf/ddcfda85064f369ffd0d9df9ba6af4f12de94d07.pdf,,1381,0,https://www.dropbox.com/request/EnMeavsHOIEB7eLiL4ay,4D
164,28,4D,Economic complexity II,D,2,1,14.45,216,Elohim Fonseca dos Reis,Complex dynamics of buyers and sellers in dark web markets,21172236,elohimfr@gmail.com,1.66666667,Elohim Fonseca dos Reis|Alex Teytelboym|Abeer ElBahrawy|Andrea Baronchelli,Social Dynamics|Cybercrime|Dark Web|Temporal Network|Resilience,/pdf/991c1a39e9fe393f3a8c42a179144b5aa67cfbe2.pdf,Yes,39,5970,https://www.dropbox.com/request/EnMeavsHOIEB7eLiL4ay,4D
165,28,4D,Economic complexity II,D,2,1,15,528,Ella Clement,Winner-takes-all job markets: A network approach,21033789,elja@math.ku.dk,1.33333333,Ella Clement,,/pdf/600f427a073dff55dcc0a7ca2b4b0c376067f8cc.pdf,Yes,61,61,https://www.dropbox.com/request/EnMeavsHOIEB7eLiL4ay,4D
166,28,4D,Economic complexity II,D,2,1,15.15,442,Kathyrn R Fair,Birds of a feather: A method for detecting suspicious clusters of companies in the UK,21162622,abeltran@turing.ac.uk,1.72727273,Alejandro Beltran|Kathyrn R Fair,firm ownership networks|shell companies|community detection|machine learning|network analysis,/pdf/a7b076848e890b3c0c54a05ef22a0c8e996e754d.pdf,Yes,68,68,https://www.dropbox.com/request/EnMeavsHOIEB7eLiL4ay,4D
167,28,4D,Economic complexity II,D,2,1,15.3,889,Sebastian Steffen,"Innovation, Adoption, and the Life Cycles of Technical Skills",21158618,sebastian.steffen88@gmail.com,1.30769231,Sebastian Steffen,Skills|Innovation|Technological Change|Open Source|Human Capital,/pdf/769554719e56f05d7ce26d2b47d82156d2efaf9e.pdf,Yes,535,535,https://www.dropbox.com/request/EnMeavsHOIEB7eLiL4ay,4D
168,28,4D,Economic complexity II,D,2,1,15.45,460,Nikolitsa Grigoropoulou,Are Large-Scale Data from Private Companies Reliable?  An Analysis of Location Data on Financial Establishments in a Popular Dataset,21163517,nikgrigo@uni-bremen.de,1.55555556,Nikolitsa Grigoropoulou|Mario L. Small,large-scale data|data quality|classification|reliability|algorithms,/pdf/2a1e93a78759c14300ec31db438d3854fe620749.pdf,Yes,19,6359,https://www.dropbox.com/request/EnMeavsHOIEB7eLiL4ay,4D
169,29,4E,Mobility and Urban Data science IV,E,2,1,14.3,667,Emilio Zagheni,Characterizing High-Skilled Mobility Patterns in Europe via LinkedIn,21162431,zagheni@demogr.mpg.de,1.27272727,Daniela Perrotta|Tom Theile|Carlos Callejo Penalba|Kiran Garimella|Ingmar Weber|Emilio Zagheni,,/pdf/0fa0f33fd5ce026aca7e39ec0ad7f611d172b71a.pdf,Yes,0,2458,https://www.dropbox.com/request/1k0SLBt2EeGJ9SOUKVrk,4E
170,29,4E,Mobility and Urban Data science IV,E,2,1,14.45,631,Lavinia Rossi Mori,Social-economic segregation dynamics at neighborhoods scale,21171194,lrossimori@gmail.com,1.08333333,Lavinia Rossi Mori|Vittorio Loreto|Riccardo Di Clemente,Mobility|GPS|Income Segregation|Social Mixing|Urban Planning,/pdf/e3ab3d2627a87b50bf50559fb37fc38676ff5e4f.pdf,Yes,0,769,https://www.dropbox.com/request/1k0SLBt2EeGJ9SOUKVrk,4E
171,29,4E,Mobility and Urban Data science IV,E,2,1,15,306,Erick Elejalde,Chile's Internal Migration Dynamics during the COVID-19 Pandemic,21162026,elejalde@l3s.de,1.61538462,Erick Elejalde|Victor Navarro|Loreto Bravo|Emilio Zagheni|Leo Ferres,internal migration|mobile data|COVID-19 pandemic|human mobility|migration dynamics,/pdf/7c0a596fcc10c6ff2d1f4c3e868a5168490d8371.pdf,,114,807,https://www.dropbox.com/request/1k0SLBt2EeGJ9SOUKVrk,4E
172,29,4E,Mobility and Urban Data science IV,E,2,1,15.15,904,Francisco Barreras,Comparing Methodologies for Constructing Epidemic Networks from GPS Mobility Data,21227652,fbarrer@sas.upenn.edu,1.45454545,Francisco Barreras|Bethany Hsiao|Duncan J Watts,GPS data|normalization|imputation|epidemic modeling|human mobility,/pdf/43e20bb1694852bfa30a2885068c5a8bc695c2e2.pdf,Yes,424,80721,https://www.dropbox.com/request/1k0SLBt2EeGJ9SOUKVrk,4E
173,29,4E,Mobility and Urban Data science IV,E,2,1,15.3,362,Nandini Iyer,Mobility and Transit Segregation in Urban Spaces.,21171371,ni244@exeter.ac.uk,0.83333333,Nandini Iyer|Ronaldo Menezes|Hugo Barbosa,Human Mobility|Transit Networks|Segregation|Socioeconomic Inequality|Transport Poverty,/pdf/4ba86193eda15aca0877be9d4b8b5371bfa3e245.pdf,Yes,746,256,https://www.dropbox.com/request/1k0SLBt2EeGJ9SOUKVrk,4E
174,29,4E,Mobility and Urban Data science IV,E,2,1,15.45,415,Yuan Liao,Exploring urban income segregation with big geolocation data on human mobility,21002730,yuan.liao@chalmers.se,1.75,Yuan Liao|Jorge Gil|Sonia Yeh|Laura Maria Alessandretti,mobile phone geolocations|income and ethnic segregation|mobility patterns,/pdf/80e5050d8f4b60c9dd8078a40b2fd98efbee5d85.pdf,Yes,2604,0,https://www.dropbox.com/request/1k0SLBt2EeGJ9SOUKVrk,4E
175,30,4F,Politics I,F,2,1,14.3,534,Giuseppe Russo,Helping a Friend or Supporting a Cause? Disentangling Active and Passive Cosponsorship Decisions in the U.S. Congress,21176360,russog@ethz.ch,1.66666667,Giuseppe Russo|Christoph Benedikt Gote|Laurence Brandenberger|Sophia Johanna Schlosser|Frank Schweitzer,politics|cosponsoring|natural language processing|graph-embeddings,/pdf/d77543941ec6487affc35090e902492068d172ea.pdf,Yes,782,10555,https://www.dropbox.com/request/2C5kDqmhiv8IqZhpBSsk,4F
176,30,4F,Politics I,F,2,1,14.45,22,Aaron Schein,Escalatory Dynamics in International Relations,20986162,schein@uchicago.edu,1.7,Niklas Stoehr|Benjamin J Radford|Ryan Cotterell|Aaron Schein,Latent Variable Models|International Relations|Bayesian Time Series|Ordinal Measurement|Political Event Data,/pdf/df34c4fd11d899d712e0247bb18322f0119994db.pdf,Yes,730,730,https://www.dropbox.com/request/2C5kDqmhiv8IqZhpBSsk,4F
177,30,4F,Politics I,F,2,1,15,772,Rémi Perrier,Real time study of the political opinion using massive data,21163100,remi.perrier@cyu.fr,1.7,Rémi Perrier|Laura Hernandez|Mariano Gastón Beiró|José Ignacio Alvarez-Hamelin|Dimitris Kotzinos,Social media|data based opinion dynamics|semantic networks|real time community tracking|memory effects in Twitter,/pdf/c8b9942cda5f93b11afa689562875fadee654da9.pdf,Yes,0,741,https://www.dropbox.com/request/2C5kDqmhiv8IqZhpBSsk,4F
178,30,4F,Politics I,F,2,1,15.15,841,Kayla Duskin,Midterm Candidate Participation in False and Misleading Election Discourse on Twitter,21099831,kayla.duskin@gmail.com,1.16666667,Kayla Duskin|Kristen Engel|Emma Spiro,twitter|user behavior|elections|rumoring|misinformation,/pdf/0d087dc33844668be01134b5e2e170f83a342669.pdf,Yes,1,1737,https://www.dropbox.com/request/2C5kDqmhiv8IqZhpBSsk,4F
179,30,4F,Politics I,F,2,1,15.3,522,Victoria Yantseva,The dissemination of alternative media content in right-leaning online communities,21161832,victoria.yantseva@it.uu.se,1.5,Victoria Yantseva|Davide Vega|Matteo Magnani,alternative media|online conversations|social media|stance classification|online communication,/pdf/84969851f8f97e670f4a1530bf8010cac9fc3db5.pdf,Yes,9,7,https://www.dropbox.com/request/2C5kDqmhiv8IqZhpBSsk,4F
180,30,4F,Politics I,F,2,1,15.45,718,Felix Schmidt,Facing the Voters - Individual and Institutional Determinants of Personalization in Social Media Images,21026123,felix.schmidt@gesis.org,1.5,Dylan Paltra|Felix Schmidt|Marius Sältzer|Lena Masch,Personalization|Images as Data|Facial Recognition|Politics|Social Media,/pdf/b97decbe6404d6e7555841f7e6127a6d6cbfbccc.pdf,Yes,214,49,https://www.dropbox.com/request/2C5kDqmhiv8IqZhpBSsk,4F
181,31,4G,Experiments,G,2,1,14.3,63,Jason Burton,Public Perceptions of Social Media Field Experiments,21073483,jb.digi@cbs.dk,2,Vincent Straub|Jason Burton|Michael Geers,field experiments|social media|ethics|research methods|survey,/pdf/bfb857b2d9e719928c250b9ceabaa5835d47701f.pdf,Yes,179,223,https://www.dropbox.com/request/KIqlY0Bh7Jiqzwe2bg2s,4G
